{
  "schema_version": "1.0.0",
  "generated_at": "2026-09-13T08:48:34.000707+00:00",
  "model": {
    "detector": "GraphSAGE edge classifier",
    "locator": "Pairwise stacked locator",
    "dataset": "Bybit-BC"
  },
  "case_count": 20,
  "cases": [
    {
      "case_id": "case-001",
      "rank": 1,
      "txhash": "7a31f23cd60b8429ccb0c4aeb64d73b0335a589f84e16101b1f18b141503052c",
      "occurred_at": "2025-03-04T21:06:51+00:00",
      "risk_score": 0.999846,
      "risk_level": "critical",
      "transfer_count": 7,
      "total_amount_btc": 4.957583,
      "recommended_address": "bc1qkkz28p78pe4qm6uthe5ayfewx5p02yufsrsnf7",
      "summary": "7개 송금 중 bc1qkkz28p78pe4qm6uthe5ayfewx5p02yufsrsnf7로 전달된 출력을 우선 조사 대상으로 추천합니다.",
      "evidence": [
        {
          "code": "GNN_PRIORITY",
          "title": "GNN 조사 우선순위",
          "detail": "거래 내 최고 위험 점수는 1.000입니다."
        },
        {
          "code": "MULTI_OUTPUT",
          "title": "다중 출력 거래",
          "detail": "한 거래에서 7개의 송금 출력이 생성됐습니다."
        },
        {
          "code": "HIGH_EXTERNAL_SHARE",
          "title": "외부 전달 비율이 높음",
          "detail": "거래 금액의 100.0%가 외부 주소로 전달됐습니다."
        },
        {
          "code": "LOCATOR_TARGET",
          "title": "우선 조사 대상 특정",
          "detail": "수신 주소 bc1qkkz28p78pe4qm6uthe5ayfewx5p02yufsrsnf7를 가장 먼저 확인해야 합니다."
        }
      ],
      "nodes": [
        {
          "id": "164KygsvvDzXMwjzVkSLogrubqsNsMgLRP",
          "role": "sender"
        },
        {
          "id": "17T7a7EuPvzKmVEujBnyuhoaobbza1Tmmk",
          "role": "sender"
        },
        {
          "id": "18n1mjbrZdPBr1yT89m9b6jLhCZMrtjX1e",
          "role": "sender"
        },
        {
          "id": "1AUAge6GJdbiSpQSfhN1dgBxG8oJHrtR45",
          "role": "sender"
        },
        {
          "id": "1GqfipoMmAVgNRYGnvXxVek7jxyXvy3N23",
          "role": "sender"
        },
        {
          "id": "1uv8p67WS3PYbrbRycSAV2hPFLAQQRRUm",
          "role": "receiver"
        },
        {
          "id": "bc1qkkz28p78pe4qm6uthe5ayfewx5p02yufsrsnf7",
          "role": "receiver"
        }
      ],
      "transfers": [
        {
          "id": "7a31f23cd60b8429ccb0c4aeb64d73b0335a589f84e16101b1f18b141503052c:116859",
          "rank": 1,
          "from_address": "17T7a7EuPvzKmVEujBnyuhoaobbza1Tmmk",
          "to_address": "bc1qkkz28p78pe4qm6uthe5ayfewx5p02yufsrsnf7",
          "amount_btc": 0.95760871,
          "amount_share": 0.19316,
          "gnn_risk_score": 0.999833,
          "locator_score": 0.999355,
          "recommended": true,
          "reasons": [
            {
              "code": "HIGH_GRAPH_RISK",
              "title": "그래프 위험도가 매우 높음",
              "detail": "연결 주소의 거래 행동과 주변 자금 흐름이 위험 패턴과 유사합니다."
            },
            {
              "code": "EXTERNAL_RECIPIENT",
              "title": "외부 주소로 전달",
              "detail": "송신 주소와 다른 주소로 자금이 이동했습니다."
            }
          ]
        },
        {
          "id": "7a31f23cd60b8429ccb0c4aeb64d73b0335a589f84e16101b1f18b141503052c:116873",
          "rank": 2,
          "from_address": "1GqfipoMmAVgNRYGnvXxVek7jxyXvy3N23",
          "to_address": "bc1qkkz28p78pe4qm6uthe5ayfewx5p02yufsrsnf7",
          "amount_btc": 0.95477252,
          "amount_share": 0.192588,
          "gnn_risk_score": 0.999846,
          "locator_score": 0.999244,
          "recommended": false,
          "reasons": [
            {
              "code": "HIGH_GRAPH_RISK",
              "title": "그래프 위험도가 매우 높음",
              "detail": "연결 주소의 거래 행동과 주변 자금 흐름이 위험 패턴과 유사합니다."
            },
            {
              "code": "EXTERNAL_RECIPIENT",
              "title": "외부 주소로 전달",
              "detail": "송신 주소와 다른 주소로 자금이 이동했습니다."
            },
            {
              "code": "SECOND_LARGEST_OUTPUT",
              "title": "두 번째로 큰 출력",
              "detail": "Bybit 데이터에서 자금세탁 라벨이 자주 나타난 거래 내부 위치입니다."
            }
          ]
        },
        {
          "id": "7a31f23cd60b8429ccb0c4aeb64d73b0335a589f84e16101b1f18b141503052c:116850",
          "rank": 3,
          "from_address": "18n1mjbrZdPBr1yT89m9b6jLhCZMrtjX1e",
          "to_address": "bc1qkkz28p78pe4qm6uthe5ayfewx5p02yufsrsnf7",
          "amount_btc": 0.95402465,
          "amount_share": 0.192437,
          "gnn_risk_score": 0.999444,
          "locator_score": 0.996991,
          "recommended": false,
          "reasons": [
            {
              "code": "HIGH_GRAPH_RISK",
              "title": "그래프 위험도가 매우 높음",
              "detail": "연결 주소의 거래 행동과 주변 자금 흐름이 위험 패턴과 유사합니다."
            },
            {
              "code": "EXTERNAL_RECIPIENT",
              "title": "외부 주소로 전달",
              "detail": "송신 주소와 다른 주소로 자금이 이동했습니다."
            }
          ]
        },
        {
          "id": "7a31f23cd60b8429ccb0c4aeb64d73b0335a589f84e16101b1f18b141503052c:116858",
          "rank": 4,
          "from_address": "164KygsvvDzXMwjzVkSLogrubqsNsMgLRP",
          "to_address": "bc1qkkz28p78pe4qm6uthe5ayfewx5p02yufsrsnf7",
          "amount_btc": 0.87968345,
          "amount_share": 0.177442,
          "gnn_risk_score": 0.999654,
          "locator_score": 0.99599,
          "recommended": false,
          "reasons": [
            {
              "code": "HIGH_GRAPH_RISK",
              "title": "그래프 위험도가 매우 높음",
              "detail": "연결 주소의 거래 행동과 주변 자금 흐름이 위험 패턴과 유사합니다."
            },
            {
              "code": "EXTERNAL_RECIPIENT",
              "title": "외부 주소로 전달",
              "detail": "송신 주소와 다른 주소로 자금이 이동했습니다."
            }
          ]
        },
        {
          "id": "7a31f23cd60b8429ccb0c4aeb64d73b0335a589f84e16101b1f18b141503052c:116872",
          "rank": 5,
          "from_address": "1AUAge6GJdbiSpQSfhN1dgBxG8oJHrtR45",
          "to_address": "bc1qkkz28p78pe4qm6uthe5ayfewx5p02yufsrsnf7",
          "amount_btc": 0.85584763,
          "amount_share": 0.172634,
          "gnn_risk_score": 0.999844,
          "locator_score": 0.994593,
          "recommended": false,
          "reasons": [
            {
              "code": "HIGH_GRAPH_RISK",
              "title": "그래프 위험도가 매우 높음",
              "detail": "연결 주소의 거래 행동과 주변 자금 흐름이 위험 패턴과 유사합니다."
            },
            {
              "code": "EXTERNAL_RECIPIENT",
              "title": "외부 주소로 전달",
              "detail": "송신 주소와 다른 주소로 자금이 이동했습니다."
            }
          ]
        },
        {
          "id": "7a31f23cd60b8429ccb0c4aeb64d73b0335a589f84e16101b1f18b141503052c:116875",
          "rank": 6,
          "from_address": "164KygsvvDzXMwjzVkSLogrubqsNsMgLRP",
          "to_address": "bc1qkkz28p78pe4qm6uthe5ayfewx5p02yufsrsnf7",
          "amount_btc": 0.19669304,
          "amount_share": 0.039675,
          "gnn_risk_score": 0.999662,
          "locator_score": 0.994208,
          "recommended": false,
          "reasons": [
            {
              "code": "HIGH_GRAPH_RISK",
              "title": "그래프 위험도가 매우 높음",
              "detail": "연결 주소의 거래 행동과 주변 자금 흐름이 위험 패턴과 유사합니다."
            },
            {
              "code": "EXTERNAL_RECIPIENT",
              "title": "외부 주소로 전달",
              "detail": "송신 주소와 다른 주소로 자금이 이동했습니다."
            },
            {
              "code": "SPLIT_OUTPUT",
              "title": "분할 송금",
              "detail": "전체 거래 금액의 10% 이하로 분리된 출력입니다."
            }
          ]
        },
        {
          "id": "7a31f23cd60b8429ccb0c4aeb64d73b0335a589f84e16101b1f18b141503052c:116874",
          "rank": 7,
          "from_address": "164KygsvvDzXMwjzVkSLogrubqsNsMgLRP",
          "to_address": "1uv8p67WS3PYbrbRycSAV2hPFLAQQRRUm",
          "amount_btc": 0.158953,
          "amount_share": 0.032063,
          "gnn_risk_score": 0.999507,
          "locator_score": 0.992279,
          "recommended": false,
          "reasons": [
            {
              "code": "HIGH_GRAPH_RISK",
              "title": "그래프 위험도가 매우 높음",
              "detail": "연결 주소의 거래 행동과 주변 자금 흐름이 위험 패턴과 유사합니다."
            },
            {
              "code": "EXTERNAL_RECIPIENT",
              "title": "외부 주소로 전달",
              "detail": "송신 주소와 다른 주소로 자금이 이동했습니다."
            },
            {
              "code": "SPLIT_OUTPUT",
              "title": "분할 송금",
              "detail": "전체 거래 금액의 10% 이하로 분리된 출력입니다."
            }
          ]
        }
      ]
    },
    {
      "case_id": "case-002",
      "rank": 2,
      "txhash": "40a5f6fe7a52dd248d983800d91a4abc6a40c88b889f74b5224adf25743b7e61",
      "occurred_at": "2025-03-04T11:28:00+00:00",
      "risk_score": 0.999836,
      "risk_level": "critical",
      "transfer_count": 3,
      "total_amount_btc": 1.57615682,
      "recommended_address": "bc1qgcsznmgxnvnnpz8n3zpr2a3lu4jnhzw9dxlc2e",
      "summary": "3개 송금 중 bc1qgcsznmgxnvnnpz8n3zpr2a3lu4jnhzw9dxlc2e로 전달된 출력을 우선 조사 대상으로 추천합니다.",
      "evidence": [
        {
          "code": "GNN_PRIORITY",
          "title": "GNN 조사 우선순위",
          "detail": "거래 내 최고 위험 점수는 0.999입니다."
        },
        {
          "code": "HIGH_EXTERNAL_SHARE",
          "title": "외부 전달 비율이 높음",
          "detail": "거래 금액의 100.0%가 외부 주소로 전달됐습니다."
        },
        {
          "code": "LOCATOR_TARGET",
          "title": "우선 조사 대상 특정",
          "detail": "수신 주소 bc1qgcsznmgxnvnnpz8n3zpr2a3lu4jnhzw9dxlc2e를 가장 먼저 확인해야 합니다."
        }
      ],
      "nodes": [
        {
          "id": "bc1q4e3tswfcc8p0cnc4sw5eclxveunmdyu6eqwa8e",
          "role": "sender"
        },
        {
          "id": "bc1qe5z0yewc4yperc9udzv4mk2fu0tkzz02txykqd",
          "role": "sender"
        },
        {
          "id": "bc1qgcsznmgxnvnnpz8n3zpr2a3lu4jnhzw9dxlc2e",
          "role": "receiver"
        },
        {
          "id": "bc1qmctc3dyyvsph46se6lgvuj5p9wt23ghjz0e2ga",
          "role": "sender"
        }
      ],
      "transfers": [
        {
          "id": "40a5f6fe7a52dd248d983800d91a4abc6a40c88b889f74b5224adf25743b7e61:113496",
          "rank": 1,
          "from_address": "bc1qmctc3dyyvsph46se6lgvuj5p9wt23ghjz0e2ga",